[
  {
    "id": 1,
    "store_id": 1,
    "employee_code": "EMP-00001",
    "full_name": "Ángel Osuna Benavente",
    "national_id": "10005938H",
    "role": "Department manager",
    "hired_at": "2018-02-18",
    "hourly_rate": 18.84,
    "active": true
  },
  {
    "id": 2,
    "store_id": 8,
    "employee_code": "EMP-00002",
    "full_name": "Socorro Tomás Clavero",
    "national_id": "74212741K",
    "role": "Butcher",
    "hired_at": "2022-12-04",
    "hourly_rate": 14.24,
    "active": true
  },
  {
    "id": 3,
    "store_id": 8,
    "employee_code": "EMP-00003",
    "full_name": "Rosalinda Ribera Catalá",
    "national_id": "50064658Y",
    "role": "Department manager",
    "hired_at": "2022-11-24",
    "hourly_rate": 21.77,
    "active": true
  },
  {
    "id": 4,
    "store_id": 7,
    "employee_code": "EMP-00004",
    "full_name": "Virgilio del Bueno",
    "national_id": "62956967X",
    "role": "Shelf stacker",
    "hired_at": "2023-06-04",
    "hourly_rate": 9.37,
    "active": true
  },
  {
    "id": 5,
    "store_id": 2,
    "employee_code": "EMP-00005",
    "full_name": "Florencia Redondo Somoza",
    "national_id": "25213311K",
    "role": "Cashier",
    "hired_at": "2019-11-27",
    "hourly_rate": 9.7,
    "active": true
  },
  {
    "id": 6,
    "store_id": 7,
    "employee_code": "EMP-00006",
    "full_name": "Javiera Barrena",
    "national_id": "75874255S",
    "role": "Security",
    "hired_at": "2022-04-22",
    "hourly_rate": 11.25,
    "active": true
  },
  {
    "id": 7,
    "store_id": 4,
    "employee_code": "EMP-00007",
    "full_name": "Yésica del Carro",
    "national_id": "23548752H",
    "role": "Security",
    "hired_at": "2019-09-04",
    "hourly_rate": 11.58,
    "active": true
  },
  {
    "id": 8,
    "store_id": 5,
    "employee_code": "EMP-00008",
    "full_name": "Clara Ibarra Villanueva",
    "national_id": "56734829Q",
    "role": "Cashier",
    "hired_at": "2022-11-12",
    "hourly_rate": 9.99,
    "active": true
  },
  {
    "id": 9,
    "store_id": 3,
    "employee_code": "EMP-00009",
    "full_name": "Oriana Riba Rodrigo",
    "national_id": "20076322J",
    "role": "Cashier",
    "hired_at": "2023-01-26",
    "hourly_rate": 12.69,
    "active": true
  },
  {
    "id": 10,
    "store_id": 7,
    "employee_code": "EMP-00010",
    "full_name": "Gabriela Carmen Galvez Cuadrado",
    "national_id": "26922672E",
    "role": "Cashier",
    "hired_at": "2023-05-05",
    "hourly_rate": 9.05,
    "active": true
  },
  {
    "id": 11,
    "store_id": 1,
    "employee_code": "EMP-00011",
    "full_name": "Ana Piedad Garcia Tena",
    "national_id": "96725075R",
    "role": "Department manager",
    "hired_at": "2011-10-05",
    "hourly_rate": 19.4,
    "active": false
  },
  {
    "id": 12,
    "store_id": 5,
    "employee_code": "EMP-00012",
    "full_name": "Carmelita de Nieto",
    "national_id": "82272611R",
    "role": "Shelf stacker",
    "hired_at": "2023-07-15",
    "hourly_rate": 10.71,
    "active": true
  },
  {
    "id": 13,
    "store_id": 4,
    "employee_code": "EMP-00013",
    "full_name": "Elba Martinez Marti",
    "national_id": "62442536C",
    "role": "Shelf stacker",
    "hired_at": "2024-04-26",
    "hourly_rate": 9.39,
    "active": true
  },
  {
    "id": 14,
    "store_id": 5,
    "employee_code": "EMP-00014",
    "full_name": "Ileana de Contreras",
    "national_id": "41231148Z",
    "role": "Security",
    "hired_at": "2024-01-27",
    "hourly_rate": 12.0,
    "active": false
  },
  {
    "id": 15,
    "store_id": 1,
    "employee_code": "EMP-00015",
    "full_name": "Julio César Villena Castillo",
    "national_id": "52781591H",
    "role": "Shelf stacker",
    "hired_at": "2018-01-13",
    "hourly_rate": 11.62,
    "active": true
  },
  {
    "id": 16,
    "store_id": 5,
    "employee_code": "EMP-00016",
    "full_name": "Isaura Téllez Raya",
    "national_id": "65625075A",
    "role": "Cashier",
    "hired_at": "2024-11-06",
    "hourly_rate": 9.0,
    "active": true
  },
  {
    "id": 17,
    "store_id": 2,
    "employee_code": "EMP-00017",
    "full_name": "Paulina Valbuena Lucena",
    "national_id": "82861432E",
    "role": "Shelf stacker",
    "hired_at": "2014-06-16",
    "hourly_rate": 9.84,
    "active": true
  },
  {
    "id": 18,
    "store_id": 7,
    "employee_code": "EMP-00018",
    "full_name": "Donato Vicens Avilés",
    "national_id": "27558780L",
    "role": "Cashier",
    "hired_at": "2022-01-14",
    "hourly_rate": 9.18,
    "active": true
  },
  {
    "id": 19,
    "store_id": 4,
    "employee_code": "EMP-00019",
    "full_name": "Gil Bermudez Alemán",
    "national_id": "05843556S",
    "role": "Security",
    "hired_at": "2024-05-15",
    "hourly_rate": 12.18,
    "active": true
  },
  {
    "id": 20,
    "store_id": 3,
    "employee_code": "EMP-00020",
    "full_name": "Victor Mayol Morales",
    "national_id": "41487274N",
    "role": "Baker",
    "hired_at": "2022-02-23",
    "hourly_rate": 11.34,
    "active": true
  },
  {
    "id": 21,
    "store_id": 8,
    "employee_code": "EMP-00021",
    "full_name": "Mariano Peinado Solana",
    "national_id": "20355585X",
    "role": "Cashier",
    "hired_at": "2023-05-21",
    "hourly_rate": 10.73,
    "active": true
  },
  {
    "id": 22,
    "store_id": 6,
    "employee_code": "EMP-00022",
    "full_name": "Ruben Gimeno",
    "national_id": "62920178K",
    "role": "Store manager",
    "hired_at": "2011-04-23",
    "hourly_rate": 23.3,
    "active": true
  },
  {
    "id": 23,
    "store_id": 6,
    "employee_code": "EMP-00023",
    "full_name": "Herberto de Montserrat",
    "national_id": "09385466V",
    "role": "Cashier",
    "hired_at": "2012-08-20",
    "hourly_rate": 11.33,
    "active": true
  },
  {
    "id": 24,
    "store_id": 5,
    "employee_code": "EMP-00024",
    "full_name": "Mariano de Amores",
    "national_id": "53072104H",
    "role": "Fishmonger",
    "hired_at": "2023-05-19",
    "hourly_rate": 14.3,
    "active": true
  },
  {
    "id": 25,
    "store_id": 1,
    "employee_code": "EMP-00025",
    "full_name": "Ignacio Cobos Baños",
    "national_id": "70329909A",
    "role": "Baker",
    "hired_at": "2011-08-09",
    "hourly_rate": 13.8,
    "active": true
  },
  {
    "id": 26,
    "store_id": 5,
    "employee_code": "EMP-00026",
    "full_name": "Ruth Sobrino Araujo",
    "national_id": "38160744H",
    "role": "Baker",
    "hired_at": "2024-09-04",
    "hourly_rate": 11.07,
    "active": true
  },
  {
    "id": 27,
    "store_id": 4,
    "employee_code": "EMP-00027",
    "full_name": "Modesta Barco Reguera",
    "national_id": "64443399K",
    "role": "Department manager",
    "hired_at": "2021-10-11",
    "hourly_rate": 17.72,
    "active": false
  },
  {
    "id": 28,
    "store_id": 8,
    "employee_code": "EMP-00028",
    "full_name": "Victoria Maxi Pozuelo Palma",
    "national_id": "71308001C",
    "role": "Cashier",
    "hired_at": "2024-12-02",
    "hourly_rate": 10.36,
    "active": true
  },
  {
    "id": 29,
    "store_id": 8,
    "employee_code": "EMP-00029",
    "full_name": "Poncio Ledesma Lucena",
    "national_id": "01028823X",
    "role": "Cashier",
    "hired_at": "2021-03-26",
    "hourly_rate": 9.58,
    "active": true
  },
  {
    "id": 30,
    "store_id": 7,
    "employee_code": "EMP-00030",
    "full_name": "Reynaldo Torrijos Rubio",
    "national_id": "74916523A",
    "role": "Cashier",
    "hired_at": "2022-07-09",
    "hourly_rate": 9.0,
    "active": true
  },
  {
    "id": 31,
    "store_id": 5,
    "employee_code": "EMP-00031",
    "full_name": "Roberta Borja Vera",
    "national_id": "87626841S",
    "role": "Cashier",
    "hired_at": "2025-05-14",
    "hourly_rate": 10.32,
    "active": true
  },
  {
    "id": 32,
    "store_id": 2,
    "employee_code": "EMP-00032",
    "full_name": "José Luis Donoso Riera",
    "national_id": "92503231Z",
    "role": "Shelf stacker",
    "hired_at": "2023-11-05",
    "hourly_rate": 9.76,
    "active": true
  },
  {
    "id": 33,
    "store_id": 7,
    "employee_code": "EMP-00033",
    "full_name": "Rosario Pomares Fuertes",
    "national_id": "86550559H",
    "role": "Cashier",
    "hired_at": "2023-09-13",
    "hourly_rate": 10.07,
    "active": true
  },
  {
    "id": 34,
    "store_id": 2,
    "employee_code": "EMP-00034",
    "full_name": "Pedro Frías Gisbert",
    "national_id": "34223534V",
    "role": "Baker",
    "hired_at": "2019-05-18",
    "hourly_rate": 12.6,
    "active": true
  },
  {
    "id": 35,
    "store_id": 6,
    "employee_code": "EMP-00035",
    "full_name": "Ovidio Arranz Viana",
    "national_id": "71165875B",
    "role": "Security",
    "hired_at": "2016-02-12",
    "hourly_rate": 10.46,
    "active": false
  },
  {
    "id": 36,
    "store_id": 7,
    "employee_code": "EMP-00036",
    "full_name": "Ceferino Valera",
    "national_id": "16176647B",
    "role": "Baker",
    "hired_at": "2023-07-09",
    "hourly_rate": 13.53,
    "active": true
  },
  {
    "id": 37,
    "store_id": 2,
    "employee_code": "EMP-00037",
    "full_name": "Esmeralda Lluch Vazquez",
    "national_id": "96590488X",
    "role": "Store manager",
    "hired_at": "2015-10-14",
    "hourly_rate": 19.47,
    "active": true
  },
  {
    "id": 38,
    "store_id": 6,
    "employee_code": "EMP-00038",
    "full_name": "Carolina de Valdés",
    "national_id": "70997624M",
    "role": "Fishmonger",
    "hired_at": "2011-12-13",
    "hourly_rate": 13.32,
    "active": true
  },
  {
    "id": 39,
    "store_id": 2,
    "employee_code": "EMP-00039",
    "full_name": "Feliciana de Peláez",
    "national_id": "27282600T",
    "role": "Cashier",
    "hired_at": "2023-08-09",
    "hourly_rate": 9.62,
    "active": false
  },
  {
    "id": 40,
    "store_id": 4,
    "employee_code": "EMP-00040",
    "full_name": "Ambrosio del Vázquez",
    "national_id": "53036407V",
    "role": "Department manager",
    "hired_at": "2020-12-10",
    "hourly_rate": 13.16,
    "active": true
  },
  {
    "id": 41,